model_metrics.csv

Model,Accuracy,AUC,Precision,Recall,F1,MCC
Logistic Regression,0.7456,0.8364,0.9448,0.7456,0.8175,0.2597
Decision Tree,0.9335,0.5477,0.9187,0.9335,0.9255,0.1218
KNN,0.9501,0.6028,0.9217,0.9501,0.9286,0.0715
Naive Bayes,0.8669,0.8018,0.9283,0.8669,0.8933,0.202
SVM,0.7613,0.776,0.9347,0.7613,0.8276,0.2023

README.md

## Observations

Logistic Regression	Achieved moderate Accuracy (74.56%) and the highest Precision (94.48%) among all models. It is effective at minimizing false positives but missed several positive cases, resulting in lower Recall and Accuracy.
Decision Tree	Delivered strong Accuracy (93.35%) and Recall (93.35%), indicating good classification performance. However, its AUC score (54.77%) was the lowest, suggesting limited ability to distinguish between classes across different thresholds.
KNN	Achieved the highest Accuracy (95.01%), Recall (95.01%), and F1 Score (92.86%). Although its AUC and MCC values were relatively low, it provided the best overall prediction performance on this dataset.
Naive Bayes	Produced balanced results with Accuracy (86.69%), AUC (80.18%), and F1 Score (89.33%). It demonstrated stable performance and good generalization but did not outperform KNN or Decision Tree.
Support Vector Machine (SVM)	Achieved moderate Accuracy (76.13%) and high Precision (93.47%). While effective at reducing false positives, its Recall and F1 Score were lower than those of KNN and Decision Tree.
Overall, Winner for your dataset?	K-Nearest Neighbors (KNN) is the best-performing model for this Stroke Prediction dataset, achieving the highest Accuracy (95.01%), Recall (95.01%), and F1 Score (92.86%). Therefore, KNN was selected as the final model for deployment in the Streamlit application.